Domain,Summary,Description,Path,Method,Client,Staff,Directory,Internal
sales,Create Product,"Each business has a limit of 8,500 products.",/business/payments/v1/products,POST,,Y,,Y
sales,Get Product [Alpha],Get Product [Alpha].,/business/payments/v1/products/{product_uid},GET,,Y,,
sales,Update Product,Update Product.,/business/payments/v1/products/{product_uid},PUT,,Y,,Y
sales,Remove Product [Alpha],Remove Product [Alpha].,/business/payments/v1/products/{product_uid},DELETE,,Y,,Y
sales,Create Refund,Creates a Refund,/business/payments/v1/refunds,POST,,Y,Y,
sales,Get list of Scheduled Payment Rules,Get a list of Scheduled Payment Rules.,/business/payments/v1/scheduled_payments_rules,GET,,Y,,
sales,Create Scheduled Payment Rule,Creates a Scheduled Payment Rule,/business/payments/v1/scheduled_payments_rules,POST,,Y,Y,
sales,Cancel Recurring Payments Rule,Cancels a Recurring Payments Rule,/business/payments/v1/scheduled_payments_rules/{uid}/cancel,PUT,,Y,Y,
sales,Get Scheduled Payment Rule,Gets a Scheduled Payment Rule.,/business/payments/v1/scheduled_payments_rules/{uid},GET,,Y,,
sales,Update Scheduled Payment Rule,Updates a Scheduled Payment Rule,/business/payments/v1/scheduled_payments_rules/{uid},PUT,,Y,Y,
sales,Create Multiple Taxes,Creates some taxes.,/business/payments/v1/tax_bulk,POST,,Y,,Y
sales,Update Multiple Taxes,Updates some taxes.,/business/payments/v1/tax_bulk,PUT,,Y,,Y
sales,Delete Multiple Taxes,Deletes some taxes.,/business/payments/v1/tax_bulk,DELETE,,Y,,Y
sales,Apply Default Taxes,Apply default taxes on items (Services/Products/Booking Packages) that don't have any taxes configured.,/business/payments/v1/tax_bulk/apply_defaults,PUT,,Y,,Y
sales,Get Taxes List [Alpha],Get Taxes List [Alpha].,/business/payments/v1/taxes,GET,,Y,,
sales,Create Tax [Alpha],Create Tax [Alpha].,/business/payments/v1/taxes,POST,,Y,,Y
sales,Get Tax [Alpha],Get Tax [Alpha].,/business/payments/v1/taxes/{tax_uid},GET,,Y,,
sales,Update Tax [Alpha],Update Tax [Alpha].,/business/payments/v1/taxes/{tax_uid},PUT,,Y,,Y
sales,Remove Tax [Alpha],Remove Tax [Alpha].,/business/payments/v1/taxes/{tax_uid},DELETE,,Y,,Y
sales,Create Transaction,Creates a Transaction,/business/payments/v1/transactions,POST,,Y,Y,
sales,Get Transaction,Gets a Transaction.,/business/payments/v1/transactions/{provider_transaction_id},GET,Y,Y,Y,
sales,Update Transaction,Updates a Transaction,/business/payments/v1/transactions/{provider_transaction_id},PUT,,Y,Y,
sales,Creates a lead,Creates a lead,/platform/v1/leadgen,POST,,Y,Y,
sales,Get Payments List,Get Payments List.,/platform/v1/payments,GET,,Y,,
sales,Create New Payment,Create New Payment.,/platform/v1/payments,POST,,Y,Y,
sales,Get Payment by ID,Get Payment by ID.,/platform/v1/payments/{payment_uid},GET,,Y,,
sales,Match Payment,Match Payment,/platform/v1/payments/{payment_uid}/match,POST,,Y,Y,
sales,Get Invoices List,Get Invoices List.,/platform/v1/invoices,GET,,,Y,
sales,Create New Invoice,Create New Invoice.,/platform/v1/invoices,POST,,,Y,
sales,Get Invoice By ID,Get Invoice By ID.,/platform/v1/invoices/{invoice_id},GET,Y,Y,Y,
sales,Create sync card,Create sync card,/platform/v1/payment/cards/sync_card,POST,,Y,Y,
sales,Delete saved card,Delete saved card,/platform/v1/payment/cards/{card_id},DELETE,,Y,Y,
sales,Update Payment Checkout (Webhook),This webhook endpoint is called by payment gateways to notify about completed checkout sessions. Requires app token authentication and valid checkout data.,/platform/v1/payment/checkout/,PUT,,,,
sales,Get Open Checkout For Specific url_key,Get Open Checkout For Specific url_key.,/platform/v1/payment/checkout/{url_key},GET,Y,Y,Y,
sales,Create Client Package,"Create a Client Package — assigns a payment package to a specific client, creating a subscription-like record with optional validity dates and custom pricing.",/platform/v1/payment/client_packages,POST,,,,
sales,Cancel Credit Redemption [Alpha],"Reverse a previous package credit redemption, restoring the consumed credit back to the client's package. This is the undo operation for `POST /platform/v1/payment/client_packages/update_usage`.",/platform/v1/payment/client_packages/cancel_redemption,PUT,,Y,,
sales,Use Client Package Credit [Alpha],Redeem a credit from a client's active package to pay for an appointment or service session. This marks the associated payment status as paid (price set to $0) and decrements one credit from the client's package.,/platform/v1/payment/client_packages/update_usage,POST,,Y,,
sales,List Catalog Packages,"Retrieve a list of package catalog templates for the business. A package is a reusable template that defines a bundle of services and/or products a client can purchase, including pricing, included credits, and a default validity period.",/platform/v1/payment/packages,GET,,Y,,
sales,Create Catalog Package,"Create a new package catalog template for the business. A package defines a bundle of services and/or products that can be sold to clients, including pricing, credit allocations per service group, and a default validity period that determines how long client subscriptions last.",/platform/v1/payment/packages,POST,,Y,,
sales,Show Catalog Package Details,"Retrieve detailed information for a single package catalog template, including its items (service/product groups), pricing, expiration settings, and active status.",/platform/v1/payment/packages/{package_id},GET,,Y,,
sales,Update Catalog Package [Alpha],"Update an existing package catalog template. You can modify pricing, name, description, expiration settings, items, and active status. Changes to the catalog template do NOT retroactively affect already-created client packages — those retain the values they were assigned at creation.",/platform/v1/payment/packages/{package_id},PUT,,Y,,
sales,Get Current Payment Settings,Get Current Payment Settings.,/platform/v1/payment/settings,GET,,Y,,
sales,Update Payment Settings,Update Payment Settings,/platform/v1/payment/settings,POST,,Y,Y,
sales,Update Default Currency,Update Default Currency,/platform/v1/payment/settings/update_default_currency,PUT,,Y,Y,
sales,Apply Coupon,"Applies a coupon code to a payment status, reducing the amount due. The payment status must reference a coupon-eligible entity type: `Meeting`, `EventAttendance`, `PendingBooking`, or `Cart`. Payment statuses for other entity types (e.g., `Invoice`, `ClientBookingPackage`, `ProductOrder`) will re...",/platform/v1/payment_statuses/{id}/apply_coupon,PUT,,Y,Y,
sales,Validate Coupon,Validates whether a coupon code can be applied to a payment status without actually applying it.,/platform/v1/payment_statuses/{id}/validate_coupon,GET,,Y,Y,
sales,Get Services List,Get services list.,/platform/v1/services,GET,,Y,,
sales,Get Services Availability,Get services availability.,/platform/v1/services/availability,GET,Y,Y,Y,
sales,Get Service Details,Get specific service details.,/platform/v1/services/{service_uid},GET,Y,Y,Y,
sales,Get Service Specific Availability,Get specific service availability.,/platform/v1/services/{service_uid}/availability,GET,Y,Y,Y,
sales,Get Client Payment Cards,Retrieve all payment cards for a client.,/platform/v1/clients/payment/cards,GET,Y,,,
sales,Get Client Payment Cards (Staff Access),Retrieve all payment cards for a specific client.,/platform/v1/clients/{client_id}/payment/cards,GET,,Y,,
sales,List stored Payment Cards,Returns stored payment cards for a client.,/v3/payments/client_payment_cards,GET,Y,Y,,
sales,Retrieve Payments Widget Data,"Fetch summarized data for the Payments widget, including total payments, overdue payments, and pending estimates. This endpoint is accessible with **Staff Tokens** only.",/v3/sales/reports/payments_widget,GET,Y,Y,Y,
sales,Retrieve Payments Forecast Data,"Fetch detailed data for the Payments forecast widget, providing predictions of future payments on a month-by-month basis. This endpoint is accessible with **Staff Tokens** only.",/v3/sales/reports/forecast_payments,GET,Y,Y,Y,
sales,Get all Credit Notes,Get a list of credit notes with pagination.,/v3/payments/credit_notes,GET,,,,
sales,Create a Credit Note,"Creates and issues a new credit note against an existing invoice. The credit note is immediately issued (no draft status). The service validates that the credit amount doesn't exceed the invoice's remaining creditable balance, generates EN 16931-compliant XML, stores it in S3, and publishes a `bi...",/v3/payments/credit_notes,POST,Y,Y,Y,
sales,Retrieve a Credit Note,Retrieves the details of a specific credit note by its UID.,/v3/payments/credit_notes/{uid},GET,Y,Y,Y,
sales,Get all PaymentGateways,Retrieve all available payment gateways -,/v3/payment_processing/payment_gateways,GET,Y,Y,Y,
sales,Create a PaymentGateway,Create a new payment gateway -,/v3/payment_processing/payment_gateways,POST,,,Y,
sales,Retrieve a PaymentGateway,Get details of a specific payment gateway -,/v3/payment_processing/payment_gateways/{uid},GET,,Y,Y,
sales,Update a PaymentGateway,Update an existing payment gateway -,/v3/payment_processing/payment_gateways/{uid},PUT,,,Y,
sales,Delete a PaymentGateway,Delete an existing payment gateway -,/v3/payment_processing/payment_gateways/{uid},DELETE,,,Y,
sales,Create a PaymentGatewayAssignment,Assign a payment gateway to a directory -,/v3/payment_processing/payment_gateway_assignments,POST,,,Y,
sales,Get Estimates List,Returns a list of estimates for the business.,/platform/v1/estimates,GET,,Y,,
sales,List Coupons,**DEPRECATED** - Use the v3 alternative `GET /v3/sales/coupons` instead.,/v2/coupons,GET,,Y,,
sales,Create Coupon,Creates a new coupon for the business.,/v2/coupons,POST,,Y,,
sales,Get Valid Coupons for Entity,**DEPRECATED** - Use the v3 alternative `GET /v3/sales/coupons` instead.,/v2/coupons/valid_coupons,GET,,Y,,
sales,Remove Coupon from Entity,"Removes a previously applied coupon from an entity (payment, appointment, or event attendance).",/v2/coupons/remove,POST,,Y,,
sales,Get Coupon,**DEPRECATED** - Use the v3 alternative `GET /v3/sales/coupons` instead.,/v2/coupons/{uid},GET,,Y,,
sales,Update Coupon,Updates an existing coupon.,/v2/coupons/{uid},PUT,,Y,,
sales,Delete Coupon,Deletes a coupon.,/v2/coupons/{uid},DELETE,,Y,,
sales,Expire Coupon,"Manually expires an active coupon, making it no longer redeemable.",/v2/coupons/{uid}/expire,POST,,Y,,
sales,Enable Coupon,"Enables a previously disabled coupon, making it redeemable again.",/v2/coupons/{uid}/enable,POST,,Y,,
sales,Disable Coupon,"Disables an active coupon, temporarily preventing it from being redeemed.",/v2/coupons/{uid}/disable,POST,,Y,,
sales,Apply Coupon to Entity,"Applies a coupon to a specific entity (payment, appointment, or event attendance), granting the associated discount.",/v2/coupons/{uid}/apply,POST,,Y,,
sales,Create an Invoice,Create a new invoice,/v3/payments/invoices,POST,,Y,,
sales,Update an Invoice,Update an existing invoice,/v3/payments/invoices/{uid},PUT,,Y,,
sales,Get all Coupons,Get a list of Coupons.,/v3/sales/coupons,GET,,Y,,
scheduling,Get Appointments List,"Retrieves a paginated list of appointments for the business. Supports filtering by client, appointment state, and sorting.",/platform/v1/scheduling/appointments,GET,,Y,Y,
scheduling,Get Appointment,Get appointment details by ID.,/platform/v1/scheduling/appointments/{appointment_id},GET,,Y,Y,
scheduling,Get Bookings [Alpha] ,Get bookings of the authenticated client. Returns a paginated list of the client's appointments and event registrations.,/platform/v1/scheduling/bookings,GET,Y,,,
scheduling,Create New Booking [Alpha],Creates a booking for either an appointment with a staff member or registration for a group event.,/platform/v1/scheduling/bookings,POST,Y,Y,,
scheduling,Cancel a Booking [Alpha],Cancel booking,/platform/v1/scheduling/bookings/cancel,POST,Y,Y,Y,
scheduling,Update RSVP state,Update RSVP state for a booking.,/platform/v1/scheduling/bookings/{booking_uid}/update_rsvp_state,PUT,Y,,,
scheduling,Get Event Attendance,Get Event attendance details for a specific event attendance record.,/platform/v1/scheduling/event_attendances/{event_attendance_uid},GET,,Y,Y,
scheduling,Get Event Instance,Get Event Instance Details.,/platform/v1/scheduling/event_instance/{event_instance_id},GET,Y,Y,Y,
scheduling,Create event Waitlist,Join an event waitlist.,/platform/v1/scheduling/waitlist,POST,Y,Y,Y,
scheduling,Cancel a Waitlist registration,Cancel a waitlist registration.,/platform/v1/scheduling/waitlist/cancel,PUT,Y,,,
scheduling,Get Staff Availability,"Returns available time slots for one or more staff members. The endpoint considers staff weekly availability schedules, calendar sync conflicts, blocked times, and existing bookings to compute open appointment or event slots.",/platform/v1/staff/availability,GET,Y,Y,Y,
scheduling,Get all AvailabilitySlots,"This endpoint returns available time slots for booking appointments. It considers staff schedules, resource availability, existing bookings, and business hours to compute open slots.",/v3/scheduling/availability_slots,GET,Y,Y,Y,
scheduling,Get all ResourceTypes,"Get a list of resource types for a business, with pagination.",/v3/scheduling/resource_types,GET,Y,Y,Y,
scheduling,Create a ResourceType,Create a new resource type,/v3/scheduling/resource_types,POST,,Y,,
scheduling,Retrieve a ResourceType,Get a specific resource type by UID.,/v3/scheduling/resource_types/{uid},GET,Y,Y,Y,
scheduling,Update a ResourceType,Update a resource type's properties,/v3/scheduling/resource_types/{uid},PUT,,Y,,
scheduling,Delete a ResourceType,Delete a resource type. Deletes all associated resources,/v3/scheduling/resource_types/{uid},DELETE,,Y,,
scheduling,Get all Resources,"Get all resources, with pagination and filtering by resource type or service.",/v3/scheduling/resources,GET,,Y,,
scheduling,Create a Resource,Create a new resource,/v3/scheduling/resources,POST,,Y,,
scheduling,Retrieve a Resource,Get a specific resource by UID.,/v3/scheduling/resources/{uid},GET,Y,Y,Y,
scheduling,Update a Resource,Update a resource's properties,/v3/scheduling/resources/{uid},PUT,,Y,,
scheduling,Delete a Resource,Soft-delete a resource,/v3/scheduling/resources/{uid},DELETE,,Y,,
scheduling,Create New Booking [Business],Create a new booking (appointment or event attendance).,/business/scheduling/v1/bookings,POST,,Y,Y,
scheduling,Accept a Booking [Business],Accept a pending booking.,/business/scheduling/v1/bookings/accept,POST,,Y,Y,
scheduling,Cancel a Booking [Business],Cancel an existing booking.,/business/scheduling/v1/bookings/cancel,PUT,,Y,Y,
scheduling,Mark booking as no show,Mark a booking as completed or no-show.,/business/scheduling/v1/bookings/complete,POST,,Y,Y,
scheduling,Update Booking Details [Business],"Update booking details including start time, staff, and notes.",/business/scheduling/v1/bookings/{booking_id},PUT,,Y,Y,
scheduling,External app bulk create external items,Bulk create or update external calendar items.,/business/scheduling/v1/external_calendar_items/bulk_create,PUT,,Y,Y,
scheduling,External app bulk deactivate external items,Bulk deactivate external calendar items.,/business/scheduling/v1/external_calendar_items/bulk_deactivate,PUT,,Y,Y,
scheduling,External app connect,Connect a staff member's calendar to an external calendar provider.,/business/scheduling/v1/external_calendar_items/connect,PUT,,Y,Y,
scheduling,External app deactivate external calendar,Deactivate a specific external calendar.,/business/scheduling/v1/external_calendar_items/deactivate_external_calendar,PUT,,Y,Y,
scheduling,External app disable,Disable calendar sync for a staff member.,/business/scheduling/v1/external_calendar_items/disable,PUT,,Y,Y,
scheduling,External app disconnect,Disconnect a staff member's calendar from an external calendar provider.,/business/scheduling/v1/external_calendar_items/disconnect,PUT,,Y,Y,
scheduling,External app report_sync_status,Report the sync status after completing a calendar sync operation.,/business/scheduling/v1/external_calendar_items/report_sync_status,PUT,,Y,Y,
scheduling,External app start_export,Start exporting vcita calendar events to an external calendar.,/business/scheduling/v1/external_calendar_items/start_export,PUT,,Y,Y,
scheduling,External app stop import,Stop importing events from an external calendar.,/business/scheduling/v1/external_calendar_items/stop_import,PUT,,Y,Y,
scheduling,General availability - Create new time slot,General availability - Create new time slot.,/business/scheduling/v1/time_slots,POST,,Y,Y,
scheduling,General availability - Update time slot,General availability - Update time slot.,/business/scheduling/v1/time_slots/{time_slot_uid},PUT,,Y,Y,
scheduling,General availability - Remove time slot,General availability - Remove time slot,/business/scheduling/v1/time_slots/{time_slot_uid},DELETE,,Y,Y,
scheduling,Get all BusinessAvailabilities,Returns available booking slots for all businesses in your directory with pagination support. This endpoint is useful for building marketplace-style booking interfaces.,/v3/scheduling/business_availabilities,GET,,,Y,
